sku,title,price,old_price,category,volume_ml,color,images,stock,is_active,date_added,description
PIA-001,Пиала целадон 90 мл,5990,,пиалы,90,зелёный,/static/img/pia001_1.jpg|/static/img/pia001_2.jpg,5,1,2024-01-15,Классическая пиала с глазурью целадон. Идеальна для чайной церемонии.
PIA-002,Матовая тёмная 70 мл,7990,8990,пиалы,70,чёрный,/static/img/pia002_1.jpg|/static/img/pia002_2.jpg,3,1,2024-02-20,Современная пиала с матовой фактурной поверхностью.
PIA-003,Белая фарфоровая 80 мл,4990,,пиалы,80,белый,/static/img/pia003_1.jpg|/static/img/pia003_2.jpg,8,1,2024-03-10,Классический белый фарфор высокого качества.
PIA-004,Синяя с узором 75 мл,6990,,пиалы,75,синий,/static/img/pia004_4.jpg,2,1,2024-06-15,Традиционная роспись кобальтом под глазурью.
PIA-005,Коричневая глиняная 100 мл,3990,,пиалы,100,коричневый,/static/img/pia005_1.jpg|/static/img/pia005_2.jpg,0,1,2024-07-01,Неглазурованная глиняная пиала ручной работы.
PIA-006,Чёрная матовая 85 мл,5490,,пиалы,85,чёрный,/static/img/pia006_2.jpg,4,1,2024-08-05,Минималистичный дизайн с матовой поверхностью.
SET-001,Набор из 4 пиал,19990,22990,наборы,,разноцветный,/static/img/set001_2.jpg,3,1,2024-08-10,Подарочный набор из четырех разных пиал в красивой упаковке.